{
  "schema": "mh.achievements",
  "schema_version": 1,
  "status": "PARAMETERS, NOT FINAL. Thresholds are placeholders. Every achievement is earnable at any time (no missable ones) and is never removed once earned.",
  "achievements": [
    {
      "id": "first_hole",
      "category": "design",
      "tier": "bronze",
      "points": 5,
      "hidden": false,
      "name_key": "achievement.first_hole.name",
      "desc_key": "achievement.first_hole.desc",
      "all": [
        {
          "stat": "holes_max",
          "op": "gte",
          "value": 1
        }
      ]
    },
    {
      "id": "nine_holes",
      "category": "design",
      "tier": "bronze",
      "points": 10,
      "hidden": false,
      "name_key": "achievement.nine_holes.name",
      "desc_key": "achievement.nine_holes.desc",
      "all": [
        {
          "stat": "holes_max",
          "op": "gte",
          "value": 9
        }
      ]
    },
    {
      "id": "full_eighteen",
      "category": "design",
      "tier": "silver",
      "points": 25,
      "hidden": false,
      "name_key": "achievement.full_eighteen.name",
      "desc_key": "achievement.full_eighteen.desc",
      "all": [
        {
          "stat": "holes_max",
          "op": "gte",
          "value": 18
        }
      ]
    },
    {
      "id": "good_hole",
      "category": "design",
      "tier": "bronze",
      "points": 5,
      "hidden": false,
      "name_key": "achievement.good_hole.name",
      "desc_key": "achievement.good_hole.desc",
      "all": [
        {
          "stat": "best_hole_score",
          "op": "gte",
          "value": 50
        }
      ]
    },
    {
      "id": "great_hole",
      "category": "design",
      "tier": "bronze",
      "points": 10,
      "hidden": false,
      "name_key": "achievement.great_hole.name",
      "desc_key": "achievement.great_hole.desc",
      "all": [
        {
          "stat": "best_hole_score",
          "op": "gte",
          "value": 70
        }
      ]
    },
    {
      "id": "masterpiece_hole",
      "category": "design",
      "tier": "silver",
      "points": 25,
      "hidden": false,
      "name_key": "achievement.masterpiece_hole.name",
      "desc_key": "achievement.masterpiece_hole.desc",
      "all": [
        {
          "stat": "best_hole_score",
          "op": "gte",
          "value": 85
        }
      ]
    },
    {
      "id": "three_good_holes",
      "category": "design",
      "tier": "bronze",
      "points": 10,
      "hidden": false,
      "name_key": "achievement.three_good_holes.name",
      "desc_key": "achievement.three_good_holes.desc",
      "all": [
        {
          "stat": "holes_good_max",
          "op": "gte",
          "value": 3
        }
      ]
    },
    {
      "id": "nine_good_holes",
      "category": "design",
      "tier": "silver",
      "points": 20,
      "hidden": false,
      "name_key": "achievement.nine_good_holes.name",
      "desc_key": "achievement.nine_good_holes.desc",
      "all": [
        {
          "stat": "holes_good_max",
          "op": "gte",
          "value": 9
        }
      ]
    },
    {
      "id": "solid_course",
      "category": "design",
      "tier": "bronze",
      "points": 10,
      "hidden": false,
      "name_key": "achievement.solid_course.name",
      "desc_key": "achievement.solid_course.desc",
      "all": [
        {
          "stat": "best_course_score",
          "op": "gte",
          "value": 40
        }
      ]
    },
    {
      "id": "fine_course",
      "category": "design",
      "tier": "silver",
      "points": 20,
      "hidden": false,
      "name_key": "achievement.fine_course.name",
      "desc_key": "achievement.fine_course.desc",
      "all": [
        {
          "stat": "best_course_score",
          "op": "gte",
          "value": 60
        }
      ]
    },
    {
      "id": "championship_course",
      "category": "design",
      "tier": "gold",
      "points": 40,
      "hidden": false,
      "name_key": "achievement.championship_course.name",
      "desc_key": "achievement.championship_course.desc",
      "all": [
        {
          "stat": "best_course_score",
          "op": "gte",
          "value": 75
        }
      ]
    },
    {
      "id": "balanced_hole",
      "category": "design",
      "tier": "silver",
      "points": 15,
      "hidden": false,
      "name_key": "achievement.balanced_hole.name",
      "desc_key": "achievement.balanced_hole.desc",
      "all": [
        {
          "stat": "best_axis",
          "op": "gte",
          "value": 70
        }
      ]
    },
    {
      "id": "first_golfer",
      "category": "design",
      "tier": "bronze",
      "points": 5,
      "hidden": false,
      "name_key": "achievement.first_golfer.name",
      "desc_key": "achievement.first_golfer.desc",
      "all": [
        {
          "stat": "golfers_finished",
          "op": "gte",
          "value": 1
        }
      ]
    },
    {
      "id": "busy_day",
      "category": "design",
      "tier": "bronze",
      "points": 10,
      "hidden": false,
      "name_key": "achievement.busy_day.name",
      "desc_key": "achievement.busy_day.desc",
      "all": [
        {
          "stat": "golfers_finished",
          "op": "gte",
          "value": 200
        }
      ]
    },
    {
      "id": "first_building",
      "category": "buildings",
      "tier": "bronze",
      "points": 5,
      "hidden": false,
      "name_key": "achievement.first_building.name",
      "desc_key": "achievement.first_building.desc",
      "all": [
        {
          "stat": "buildings_built",
          "op": "gte",
          "value": 1
        }
      ]
    },
    {
      "id": "clubhouse_two",
      "category": "buildings",
      "tier": "bronze",
      "points": 5,
      "hidden": false,
      "name_key": "achievement.clubhouse_two.name",
      "desc_key": "achievement.clubhouse_two.desc",
      "all": [
        {
          "stat": "tier_clubhouse",
          "op": "gte",
          "value": 2
        }
      ]
    },
    {
      "id": "clubhouse_three",
      "category": "buildings",
      "tier": "bronze",
      "points": 10,
      "hidden": false,
      "name_key": "achievement.clubhouse_three.name",
      "desc_key": "achievement.clubhouse_three.desc",
      "all": [
        {
          "stat": "tier_clubhouse",
          "op": "gte",
          "value": 3
        }
      ]
    },
    {
      "id": "clubhouse_four",
      "category": "buildings",
      "tier": "silver",
      "points": 20,
      "hidden": false,
      "name_key": "achievement.clubhouse_four.name",
      "desc_key": "achievement.clubhouse_four.desc",
      "all": [
        {
          "stat": "tier_clubhouse",
          "op": "gte",
          "value": 4
        }
      ]
    },
    {
      "id": "five_buildings",
      "category": "buildings",
      "tier": "bronze",
      "points": 10,
      "hidden": false,
      "name_key": "achievement.five_buildings.name",
      "desc_key": "achievement.five_buildings.desc",
      "all": [
        {
          "stat": "buildings_built",
          "op": "gte",
          "value": 5
        }
      ]
    },
    {
      "id": "all_buildings",
      "category": "buildings",
      "tier": "gold",
      "points": 30,
      "hidden": false,
      "name_key": "achievement.all_buildings.name",
      "desc_key": "achievement.all_buildings.desc",
      "all": [
        {
          "stat": "buildings_built",
          "op": "gte",
          "value": 10
        }
      ]
    },
    {
      "id": "fine_dining",
      "category": "buildings",
      "tier": "bronze",
      "points": 10,
      "hidden": false,
      "name_key": "achievement.fine_dining.name",
      "desc_key": "achievement.fine_dining.desc",
      "all": [
        {
          "stat": "tier_restaurant",
          "op": "gte",
          "value": 3
        }
      ]
    },
    {
      "id": "guest_rooms",
      "category": "buildings",
      "tier": "bronze",
      "points": 10,
      "hidden": false,
      "name_key": "achievement.guest_rooms.name",
      "desc_key": "achievement.guest_rooms.desc",
      "all": [
        {
          "stat": "tier_lodging",
          "op": "gte",
          "value": 2
        }
      ]
    },
    {
      "id": "first_home",
      "category": "buildings",
      "tier": "bronze",
      "points": 10,
      "hidden": false,
      "name_key": "achievement.first_home.name",
      "desc_key": "achievement.first_home.desc",
      "all": [
        {
          "stat": "tier_homes",
          "op": "gte",
          "value": 1
        }
      ]
    },
    {
      "id": "tier_five_first",
      "category": "buildings",
      "tier": "gold",
      "points": 30,
      "hidden": false,
      "name_key": "achievement.tier_five_first.name",
      "desc_key": "achievement.tier_five_first.desc",
      "all": [
        {
          "stat": "tier5_count",
          "op": "gte",
          "value": 1
        }
      ]
    },
    {
      "id": "tier_sum_twenty",
      "category": "buildings",
      "tier": "silver",
      "points": 20,
      "hidden": false,
      "name_key": "achievement.tier_sum_twenty.name",
      "desc_key": "achievement.tier_sum_twenty.desc",
      "all": [
        {
          "stat": "tier_sum",
          "op": "gte",
          "value": 20
        }
      ]
    },
    {
      "id": "landmark_built",
      "category": "buildings",
      "tier": "gold",
      "points": 40,
      "hidden": false,
      "name_key": "achievement.landmark_built.name",
      "desc_key": "achievement.landmark_built.desc",
      "all": [
        {
          "stat": "tier_landmark",
          "op": "gte",
          "value": 1
        }
      ]
    },
    {
      "id": "more_land",
      "category": "growth",
      "tier": "bronze",
      "points": 5,
      "hidden": false,
      "name_key": "achievement.more_land.name",
      "desc_key": "achievement.more_land.desc",
      "all": [
        {
          "stat": "parcels_max",